{
  "$schema": "https://json-schema.org/draft/2020-12/schema",
  "title": "wave_front state snapshot",
  "description": "A dated estimate of the current state with provenance (DESIGN.md section 5.1, framework_spec.md section 9). Every variable carries a level, a confidence and the indicators it was read from (or, over a contested window, a set of such levels); only a variable with confidence 'assumed' may have an empty indicator list. The optional builtins section sets the model's built-in variables (pending delayed decisions, last actions, latches, fairness counters; phase 2 decision F2) with the same provenance and a rule. Rates are validated here and are not part of the state.",
  "type": "object",
  "required": ["date", "model", "variables"],
  "additionalProperties": false,
  "properties": {
    "$schema": {
      "description": "Optional pointer to this schema, for editors.",
      "type": "string"
    },
    "date": {
      "description": "The date the estimate is for, YYYY-MM-DD.",
      "$ref": "#/$defs/date"
    },
    "model": {
      "description": "The model (or model version) the variable names and levels refer to.",
      "type": "string",
      "minLength": 1
    },
    "variables": {
      "description": "Declared model variables by name. A variable declared with init=None in the model must be fixed here.",
      "type": "object",
      "propertyNames": { "$ref": "#/$defs/name" },
      "additionalProperties": {
        "oneOf": [{ "$ref": "#/$defs/variable" }, { "$ref": "#/$defs/variable_set" }]
      }
    },
    "builtins": {
      "description": "Built-in variables of the model by name (decision F2): pending_<actor>_<action> with the ticks remaining until the delayed effect applies (0 to the action's delay), last_<actor> with an action name or 'none', a latch with one of its levels or 'unset', fair_<name> with its count (0 to the constraint's 'within'). The loader fills them into the state after the variables and refuses a name that is not a settable built-in of the model (tick included) and a value out of range. Declared variables cannot be set here, and built-ins cannot be set in variables.",
      "type": "object",
      "propertyNames": { "$ref": "#/$defs/name" },
      "additionalProperties": { "$ref": "#/$defs/builtin" }
    },
    "rates": {
      "description": "Observed lags and growth caps, by name. Evidence for the rates of the model; they never edit its transition relation.",
      "type": "object",
      "propertyNames": { "$ref": "#/$defs/name" },
      "additionalProperties": { "$ref": "#/$defs/rate" }
    }
  },
  "$defs": {
    "date": {
      "type": "string",
      "pattern": "^[0-9]{4}-[0-9]{2}-[0-9]{2}$",
      "format": "date"
    },
    "name": {
      "type": "string",
      "pattern": "^[A-Za-z_][A-Za-z0-9_]*$"
    },
    "variable": {
      "type": "object",
      "required": ["level", "confidence", "indicators"],
      "additionalProperties": false,
      "properties": {
        "level": {
          "description": "A level name for a leveled variable, an integer for a counter, a boolean for a flag.",
          "type": ["string", "integer", "boolean"],
          "minLength": 1
        },
        "confidence": {
          "enum": ["high", "medium", "low", "assumed"]
        },
        "indicators": {
          "type": "array",
          "items": { "$ref": "#/$defs/indicator" }
        }
      },
      "if": {
        "required": ["confidence"],
        "properties": { "confidence": { "not": { "const": "assumed" } } }
      },
      "then": {
        "properties": { "indicators": { "minItems": 1 } }
      }
    },
    "variable_set": {
      "description": "A set of levels over a contested window (docs/ambiguous_levels.md): the snapshot denotes one state per member level (the product over all set-valued variables), and an analysis reports each finding as robust (the same from every member) or fragile. Each member carries its own confidence and indicators; 'ambiguity' says why the threshold's crossing is a judgement here. Mutually exclusive with 'level'. The loader refuses a level given twice.",
      "type": "object",
      "required": ["levels", "ambiguity"],
      "additionalProperties": false,
      "properties": {
        "levels": {
          "type": "array",
          "minItems": 2,
          "items": { "$ref": "#/$defs/variable" }
        },
        "ambiguity": {
          "description": "Why the level is contested over this window: the threshold, the readings and their dates.",
          "type": "string",
          "minLength": 1
        }
      }
    },
    "builtin": {
      "type": "object",
      "required": ["value", "confidence", "indicators", "rule"],
      "additionalProperties": false,
      "properties": {
        "value": {
          "description": "A non-negative integer for a pending or fairness counter (and a latch of the tick), an action name or 'none' for a last action, a level name or 'unset' for a latch (a boolean for a latch of a flag).",
          "type": ["string", "integer", "boolean"],
          "minLength": 1,
          "minimum": 0
        },
        "confidence": {
          "enum": ["high", "medium", "low", "assumed"]
        },
        "indicators": {
          "type": "array",
          "items": { "$ref": "#/$defs/indicator" }
        },
        "rule": {
          "description": "How the value follows from the indicators (for a counter, the arithmetic); with confidence 'assumed', why no indicator supports it.",
          "type": "string",
          "minLength": 1
        }
      },
      "if": {
        "required": ["confidence"],
        "properties": { "confidence": { "not": { "const": "assumed" } } }
      },
      "then": {
        "properties": { "indicators": { "minItems": 1 } }
      }
    },
    "indicator": {
      "type": "object",
      "required": ["id", "value", "source", "observed", "rule"],
      "additionalProperties": false,
      "properties": {
        "id": { "type": "string", "minLength": 1 },
        "value": {
          "description": "The raw observation.",
          "type": ["string", "number", "boolean"],
          "minLength": 1
        },
        "source": {
          "description": "Where it was read: a URL or a citation.",
          "type": "string",
          "minLength": 1
        },
        "observed": {
          "description": "The date of the observation, YYYY-MM-DD.",
          "$ref": "#/$defs/date"
        },
        "rule": {
          "description": "The mapping rule from the observation to the level.",
          "type": "string",
          "minLength": 1
        }
      }
    },
    "rate": {
      "type": "object",
      "required": ["ticks", "basis"],
      "additionalProperties": false,
      "properties": {
        "ticks": { "type": "integer", "minimum": 0 },
        "basis": { "type": "string", "minLength": 1 }
      }
    }
  }
}
